PubmedID,Title,Publication Date,Non-academic Author(s),Company Affiliation(s),Corresponding Author Email
40050545,Comparative Analysis of the Traditional Elliptic Excision and Dermoglandular Posteroinferior Flap Technique for Grade III Gynecomastia.,2025 Mar 6,Moris V; Renom M; Santamaria N; Zwetyenga N; Pluvy I; See LA,,
40050499,"Ependymal invasion in High-Grade Glioma. Impact on surgical, functional outcomes, and survival rates. Experience in a Latin-American center.",2025 Mar 7,Ruella ME; Caffaratti G; Del Pont FM; Muggeri A; Yorio F; Mormandi R; Cervio A,,
40050422,Cancer-intrinsic Cxcl5 orchestrates a global metabolic reprogramming for resistance to oxidative cell death in 3D.,2025 Mar 7,Seo R; de Guzman ACV; Park S; Lee JY; Kang SJ,,
40050197,"Genomic Profiling of Driver Gene Alterations in Patients With Non-Small Cell Lung Cancer, Patterns of Treatment and Impact on Survival Outcomes: A Single Center Experience of More Than 1200 Patients.",2025 Feb 11,Shah M; Noronha V; Patil V; Singh AK; Menon N; Goud S; Shah S; More S; Kapoor A; Mishra BK; Chandrani P; Chougule A; Gupta V; Pange P; Shetty O; Pai T; Kaushal R; Yadav S; Basu M; Vora D; Vaidyanathan A; Kumar P; Jacob R; Shah A; Pradhan RR; Samaddar D; Shenoy V; Singh B; Puviarasan R; Bagra S; Desai R; Saldanha E; Poojary D; Pathak A; Ray S; Bhardwaj H; Shetty U; Iyer R; Das R; Mer N; Shah H; Kaushal Y; Singh A; Panmand H; Gosavi G; Ubharay A; Iyer A; Turel U; Shetake A; Maske K; Janu A; Purandare N; Pawar A; Mandhania M; Prabhash K,,
40050091,[Diagnostic PICALM::MLLT10 fusion by transcriptome sequencing in acute myeloid leukemia and its clinical characteristics].,2025 Mar 1,Xia J; Hu XH; Zhao Y; Ma X; Wu DP; Chen SN; Chen F,,
40050076,[An analysis of clinical and genetic feature in pulmonary artery sarcoma].,2025 Mar 12,Jiang Q; Yan H; Huang C; Ma R; Zhang CT; Yang K; Wang J; Liu CL,,
40050060,Screening to identify people with type 2 diabetes at risk of liver cancer in primary care: a randomised controlled trial protocol.,2025 Mar 6,Buchanan RM; Reinson T; Bilson J; Woodland H; Nwoguh C; Cooper K; Harris S; Malone K; Byrne CD,,
40050050,Prevalence and risk factors of persistent cough in patients diagnosed with renal cell carcinoma: a systematic review and meta-analysis.,2025 Mar 6,Smith W; Santiapillai J; Loizidou M; Mazzone S; Tran MGB; Patra HK; Omar MI; Mumtaz F,,
40049811,A digital application increases the accuracy and reduces the time required to determine the stage of endometrial cancer according to the 2023 FIGO staging system.,2025 Mar,Cheng NM; Lin YT; Lin SY; Chang YH; Chen YJ,,
40049802,Application of 2023 FIGO staging system for 2019 FIGO stage I endometrial cancer.,2025 Mar,Wang PH; Anggraeni TD; Utami TW,,
40049556,Changes in employment and practice locations among radiation oncologists: 2015 - 2023.,2025 Mar 4,Lu SG; Sindhu KK; Rowley JP,,
40049273,"PM(10)-bound elements in Luanda's urban atmosphere: Concentrations, sources, and their environmental and health impacts.",2025 Mar 4,Alves CA; Sanchez de la Campa A; Cipoli Y; Furst L; Higawa G; Leitão A; da Silva AV; Feliciano MS,,
40049205,Active surveillance of cervical intraepithelial neoplasia grade 2: 2025 British Society of Colposcopy and Cervical Pathology and European Society of Gynaecologic Oncology consensus statement.,2025 Mar,Kyrgiou M; Bowden SJ; Ellis LB; Hammer A; Lyons D; Freeman-Wang T; Kechagias KS; Kalliala I; Preti M; Kesic V; Zapardiel I; Cruickshank M; Gultekin M; Martin-Hirsch P,,
40049197,"Activity and safety of atezolizumab plus carboplatin and paclitaxel in patients with advanced or recurrent thymic carcinoma (MARBLE): a multicentre, single-arm, phase 2 trial.",2025 Mar,Shukuya T; Asao T; Goto Y; Mimori T; Takayama K; Kaira K; Tanaka H; Ko R; Amano Y; Tachihara M; Suzuki T; Tanizaki J; Sugawara S; Zenke Y; Shirai Y; Hayashi T; Mori K; Takahashi K,,
40049196,"ADT with SBRT versus SBRT alone for hormone-sensitive oligorecurrent prostate cancer (RADIOSA): a randomised, open-label, phase 2 clinical trial.",2025 Mar,Marvaso G; Corrao G; Zaffaroni M; Vincini MG; Lorubbio C; Gandini S; Fodor C; Netti S; Zerini D; Luzzago S; Mistretta FA; Venetis K; Cursano G; Burla T; Mazzocco K; Cattani F; Petralia G; Fusco N; Pravettoni G; Musi G; De Cobelli O; Tang C; Ost P; Palma DA; Orecchia R; Jereczek-Fossa BA,,
40049189,Antimicrobials in serious illness and end-of-life care: lifting the veil of silence.,2025 Mar 3,Rosa WE; Pandey S; Wisniewski R; Blinderman C; Cheong MWL; Correa-Morales JE; Cubides-Diaz DA; Folorunso S; Gafer N; Marhoom M; Newman T; Ntizimira C; Obadare TO; Papan C; Pérez-Cruz PE; Radbruch L; Rajahram GS; Reyes-Barros TA; Salins N; Saravu K; Sullivan DR; Dee EC,,
40049186,"Global, regional, and national prevalence of adult overweight and obesity, 1990-2021, with forecasts to 2050: a forecasting study for the Global Burden of Disease Study 2021.",2025 Mar 8,GBD 2021 Adult BMI Collaborators,,
40049185,"Global, regional, and national prevalence of child and adolescent overweight and obesity, 1990-2021, with forecasts to 2050: a forecasting study for the Global Burden of Disease Study 2021.",2025 Mar 8,GBD 2021 Adolescent BMI Collaborators,,
40049086,The efficacy of ICIs rechallenge in advanced small cell lung cancer after progression from ICIs plus chemotherapy: A real-world study.,2025 Mar 4,Liu F; Yin G; Tao Y; Pan Y,,
40048983,All-cause mortality and neighborhood social vulnerability among women with ovarian cancer.,2025 Mar 5,Hicks A; Borho L; Elishaev E; Berger J; Boisen M; Comerci J; Courtney-Brooks M; Edwards RP; Garrett AA; Kelley JL; Lesnock J; Mahdi HS; Olawaiye A; Rush S; Sukumvanich P; Taylor S; Modugno F,,
40048931,Durability of COVID-19 vaccine and infection induced immunity: A systematic review and meta-regression analysis.,2025 Mar 5,Moore M; Anderson L; Schiffer JT; Matrajt L; Dimitrov D,,
40048856,Current controversies in the use of Oncotype DX in early breast cancer.,2025 Jan 16,Berton Giachetti PPM; Carnevale Schianca A; Trapani D; Marra A; Toss A; Marchiò C; Dieci MV; Gentilini OD; Criscitiello C; Kalinsky K; Sparano JA; Curigliano G,,
40048719,Butter and Plant-Based Oils Intake and Mortality.,2025 Mar 6,Zhang Y; Chadaideh KS; Li Y; Li Y; Gu X; Liu Y; Guasch-Ferré M; Rimm EB; Hu FB; Willett WC; Stampfer MJ; Wang DD,,
40048317,"Benefits and challenges of cervical cancer screening since the implementation of the 'two cancer' screening programme in China: findings from Shangyu, Zhejiang in 2019-23.",2025 Mar 7,Wu Y; Luo J; Ye D; Gao S,,
40048195,Genetic and Molecular Differences in Head and Neck Cancer Based on Smoking History.,2025 Mar 6,Jiang R; Gao MZ; Chen M; Weatherspoon DJ; Watts TL; Osazuwa-Peters N,,
40048190,Neoadjuvant Nivolumab Plus Chemotherapy Followed by Response-Stratified Chemoradiation Therapy in HPV-Negative Head and Neck Cancer: The DEPEND Phase 2 Nonrandomized Clinical Trial.,2025 Mar 6,Rosenberg AJ; Juloori A; Jelinek MJ; Agrawal N; Cursio JF; Cipriani N; Lingen MW; Izumchenko E; Katipally R; Chin J; Ginat D; Pasternak-Wise O; Gooi Z; Blair E; Pearson AT; Haraf DJ; Vokes EE,,
40048162,"Intentional Weight Loss, Waist Circumference Reduction, and Mortality Risk Among Postmenopausal Women.",2025 Mar 3,Hendryx M; Manson JE; Ostfeld RJ; Chlebowski RT; LeBlanc ES; Waring ME; Barrington WE; Bittoni MA; Wassertheil-Smoller S; Herold JG; Luo J,,
40048112,"Inhibitory effects of carbohydrazide indole derivative on micro-blood vessel growth using ex vivo, in vivo, and in vitro assays.",2025 Mar 6,Khaleel BJ; Ridha-Salman H; Kadhim HM; Hassan OM; Kubba A; Sahib HB,,
40048028,How to Perform Bilateral Sentinel Lymph Node Biopsy in Vulvar Cancer with Indocyanine Green by Video-Endoscopic Approach.,2025 Mar 6,Bizzarri N; Capomacchia FM; Guidi G; Fragomeni SM; Garganese G; Fagotti A; Scambia G; Naldini A,,
40048021,Dual Targeting of Neuropilin-1 and Glucose Transporter for Efficient Fluorescence Imaging of Cancer.,2025 Mar 6,Zhu J; Zhou C; Yang J; Wang Z,,
40047969,Pan-cancer investigation regarding the prognostic predictive and immunological regulation functions of PGK1 and experimental validation in esophageal squamous cell carcinoma.,2025 Mar 6,Chen J; Wu X; Luo H; Wang D; Dong M; Wang Y; Ou Y; Sun S; Liu Z; Zhang Q; Guan Q,,
40047951,Global trends and research hotspots in nanodrug delivery systems for breast cancer therapy: a bibliometric analysis (2013-2023).,2025 Mar 6,Li Y; Liu P; Zhang B; Chen J; Yan Y,,
40047926,Evaluation of hand-assisted laparoscopic surgery of small intestinal neuroendocrine tumours as an alternative surgical treatment to open surgery.,2025 Mar 6,Klimácek B; Åkerström T; Annebäck M; Hellman P; Norlén O; Stålberg P,,
40047783,Area Deprivation Index and Melanoma Thickness in Veterans.,2025 Mar 6,Moncayo AK; Ferguson JM; Dizon MP; Huhmann L; Kim DY; Do N; Brophy MT; Osborne TF; Spence AC; Fillmore NR; Swetter SM; Hartman RI,,
40047474,[In-depth identification of para-Bombay blood type in cancer patients using third-generation sequencing technology].,2025 Feb,Wang N; Yu X; Chen Y,,
40047292,Understanding patient perspectives in the management of their muscle-invasive bladder cancer.,2025 Mar 6,Chowdhury D; Apolo AB; Jiang DM; Skinner EC; Chisolm S; Bangs R; Maganti M; Steinberg GD; Kaag M; Efstathiou JA; Sridhar SS,,
40047199,Prevalence and Risk Factors of L-Asparaginase-Related Thrombosis Among Acute Lymphoblastic Lymphoma Patients in a Resource-Limited Setup of Sub-Saharan Region.,2025 Mar,Abrar Mohammed A; Abdela F; Tasamma AT; Shewangizaw YK; Weldeamanuel MT,,
40047086,The Incidence of Occult Malignancy in Contralateral Risk Reducing Mastectomy Among Affected Breast Cancer Gene Mutation Carriers in South Korea.,2025 Feb,Lee CE; Shin DS; Kim KJ; Nam SJ; Kim SW; Yu J; Chae BJ; Lee SK; Ryu JM; Mun GH; Pyon JK; Jeon BJ; Woo K; Lee JE,,
40047078,Mono-TKI and TKI Plus ICI in Unresectable Hepatocellular Carcinoma Progression on First-Line Treatment of Lenvatinib: A Real-World Study.,2025 Mar,Yin X; Deng N; Chen J; Ding X,,
40047068,Surgery for Borderline Resectable and Locally Advanced Pancreatic Cancer with Arterial Encasement after Neoadjuvant Therapy: A Single-center Experience.,2025 Mar 6,Ishida H; Franklin O; Franco SR; Clark TJ; Stoop TF; Kirsch MJ; Schulick RD; Del Chiaro M,,
40047060,Difference-Makers for Collecting Sexual Orientation and Gender Identity Data in Oncology Settings.,2025 Mar,Pratt-Chapman ML; Miech EJ; Mullins MA; Chang S; Quinn GP; Maingi S; Schabath MB; Kamen C,,
40046885,Activity of Rezafungin Against Echinocandin Non-wild type Candida glabrata Clinical Isolates From a Global Surveillance Program.,2025 Mar,Castanheira M; Deshpande LM; Kimbrough JH; Winkler M,,
40046668,Efficacy and prognosis biomarker of locally advanced ESCC patients treated with neoadjuvant chemotherapy and anti-PD-1 immunotherapy.,2024,Li S; Zhou J; Wang Q; Chen J; Qi Y,,
40046653,Real-World Treatment Patterns and Survival Outcomes in Metastatic Hormone-Sensitive Prostate Cancer: Insights From a Retrospective Cohort Study.,2025,Tashkandi E,,
40046626,Assessment of non-tumor liver parenchyma damage in advanced gastric cancer treatment with transarterial infusion chemotherapy: a study using imaging and hepatic injury indicators.,2025,Jing Y; Jing J; Sun X; Jin Y; Bai X,,
40046524,Impact of preoperative anemia and perioperative transfusion on short-term outcomes in colorectal cancer surgery: The role of iron supplementation.,2025 Mar,Takashima J; Kobayashi H; Koizumi A; Shigehara F; Yamazaki K; Fujimoto D; Miura F,,
40046523,Risk factors for postoperative complications in laparoscopic and robot-assisted surgery for octogenarians with colorectal cancer: A multicenter retrospective study.,2025 Mar,Yamamoto T; Hida K; Goto K; Fukuda M; Inamoto S; Hashida H; Matsusue R; Takahashi R; Mizuno R; Terajima H; Obama K,,
40046517,Risk stratification of residual abscess after surgical treatment for gastroduodenal perforation.,2025 Mar,Ishikawa K; Yao S; Kumode T; Tanino K; Matsui Y; Honma S; Hosokawa S; Murakami T; Kan T; Nakajima S,,
40046312,Revisiting the Need for Breast Imaging in Young Women with Clinically Significant Breast Pain and a Normal Physical Breast Examination.,2025 Mar 3,Rotbart N; Kaminsky O; Aranovich D; Shochat T; Atar E; Grubstein A,,
40046105,The impact of biopsy core length on the discrepancy in Gleason scores between biopsy and radical prostatectomy specimen.,2025 Mar,Guo CH; Geng YS; Zhu LY; Ding XF; Luan Y,,
40046036,Management and surveillance of metastatic giant cell tumour of bone.,2025,Fellows D; Kotowska J; Stevenson T; Brown J; Orosz Z; Siddiqi A; Whitwell D; Cosker T; GIbbons CLMH,,
40045875,Investigation of the relationship between helicobacter pylori positivity and colon polyps in simultaneous oesophagogastroduodenoscopy and colonoscopy procedures.,2025 Mar 5,Çimen Ş; Kamburoğlu A; Uçaner B; Kaymak Ş,,
40045486,Vascularised organoids: Recent advances and applications in cancer research.,2025 Mar,Zhou R; Brislinger D; Fuchs J; Lyons A; Langthaler S; Hauser CAE; Baumgartner C,,
40045415,"Investigation and analysis of female HPV infection and genotype distribution in Xuhui District, Shanghai.",2025 Mar 5,Liu H; Jiang M; Wu J; Dai Y; Xu M; Wang L; Ji M,,
40045379,Focal adhesion in the tumour metastasis: from molecular mechanisms to therapeutic targets.,2025 Mar 5,Liu Z; Zhang X; Ben T; Li M; Jin Y; Wang T; Song Y,,
40045373,A chimeric antigen receptor tailored to integrate complementary activation signals potentiates the antitumor activity of NK cells.,2025 Mar 6,Yi E; Lee E; Park HJ; Lee HH; Yun SH; Kim HS,,
40045324,Clinical progression following acellular dermal matrix use for volume replacement after breast-conserving surgery.,2025 Mar 5,Kwon J; Byon JH; Ko BK; Kim JS; Bang M,,
40045322,Preoperative heart rate variability as a predictor of postoperative pneumonia and lung function recovery in surgical lung cancer patients: a prospective observed study.,2025 Mar 6,Lai Y; Zhou S; Tian L; Li H; Ye X; Che G,,
40045308,Nanophotonic-enhanced photoacoustic imaging for brain tumor detection.,2025 Mar 5,Rizwan A; Sridharan B; Park JH; Kim D; Vial JC; Kyhm K; Lim HG,,
40045277,Development and validation of a predictive model for diagnosing EBER-positive lymphoma-associated hemophagocytic lymphohistiocytosis.,2025 Mar 5,Yin Y; Zhang W; Zhao L; Li Y; Huang M; Han Y; Wu X,,
40045233,Understanding oncologic emergencies and related emergency department visits and hospitalizations: a systematic review.,2025 Mar 5,Yilmaz S; Aryal K; King J; Bischof JJ; Hong AS; Wood N; Gould Rothberg BE; Hudson MF; Heinert SW; Wattana MK; Coyne CJ; Reyes-Gibby C; Todd K; Lyman G; Klotz A; Abar B; Grudzen C; Bastani A; Baugh CW; Henning DJ; Bernstein S; Rico JF; Ryan RJ; Yeung SJ; Qdaisat A; Padela A; Madsen TE; Liu R; Adler D,,
40045214,Choledocholithiasis as a risk factor for cholangiocarcinoma: a nationwide retrospective cohort study.,2025 Mar 5,Kim J; Lee YS; Lee JC; Hwang JH,,
40045186,Natural flavonoid Orientin restricts 5-Fluorouracil induced cancer stem cells mediated angiogenesis by regulating HIF1α and VEGFA in colorectal cancer.,2025 Mar 5,Ghosh R; Bhowmik A; Biswas S; Samanta P; Sarkar R; Pakhira S; Mondal M; Hajra S; Saha P,,
40045179,Genetic Landscape of Mucosal Melanoma: Identifying Pathogenic Germline Variants.,2025 Mar,Ribaudo I; Arbesman M; Ni Y; Isaacs J; Kennedy LB; Ko J; Funchain P; Truong TG; Arbesman J,,
40045142,Threshold size criterion to suspect malignant supraclavicular lymph node < 10 mm in esophageal cancer.,2025 Mar 5,Huang Y; Du J; Li Q; Fan T; Wang Z; Chu F; Li J; Li B; Yang X; Zhang R; Kamel IR; Zhou Y; Li Z; Qu J,,
40045058,Post-esophagectomy hiatal hernia following minimally invasive esophagectomy in esophageal cancer patients.,2025 Mar 5,Chobarporn T; Qureshi AP; Hunter JG; Wood SG,,
40045045,Addressing uncertainty in hereditary colorectal cancer: the role of a regional expert multidisciplinary team meeting.,2025 Mar 6,Varde A; McVeigh T; Cuthill V; Brady AF; DeSouza B; Latchford A; Monahan KJ,,
40044980,Selective internal radiation with Y-90 resin microspheres (SIRT) for liver metastases of gastro-intestinal stromal tumors (GIST) resistant to tyrosine kinase inhibitor (TKI) therapy.,2025 Mar 5,Hohenberger P; Rathmann N; Büsing K; Menge F; Jakob J; Pink D; Wardelmann E; Schoenberg SO; Diehl SJ,,
40044930,Pembrolizumab plus chemotherapy in advanced or recurrent endometrial cancer: overall survival and exploratory analyses of the NRG GY018 phase 3 randomized trial.,2025 Mar 5,Eskander RN; Sill MW; Beffa L; Moore RG; Hope JM; Musa FB; Mannel RS; Shahin MS; Cantuaria GH; Girda E; Lokich E; Kavecansky J; Leath CA 3rd; Gien LT; Hinchcliff EM; Lele SB; Landrum LM; Backes F; O'Cearbhaill RE; Baghdadi TA; Hill EK; Thaker PH; John VS; Welch S; Fader AN; Powell MA; Aghajanian C,,
40044876,The LncRNA lnc-POTEM-4:14 promotes HCC progression by interacting with FOXK1.,2025 Mar 5,Peng B; Quan Z; Liang L; Liu M; Hu K; Chen S; Xie Q; Qin J; Chen J; Liao L; He S; Li Z,,
40044844,Pharmacovigilance analysis of immune checkpoint inhibitor-related reproductive adverse effects based on the FDA adverse event reporting system.,2025 Mar 5,Köylü B; Esen BH; Bektaş ŞN; Özbek L; Turan V; Urman B; Öktem Ö; Selçukbiricik F,,
40044564,Navigating treatment ambiguities in head and neck squamous cell carcinoma: A retrospective analysis of equivocal PET-CT findings and decision-making strategies following primary non-surgical treatment.,2025 Feb 6,Chai A; Srao S; Walker E; Panditaratne N; Ho MWS,,
40044508,Improved survival with adding-on strategy after failure of nanoliposomal irinotecan plus 5-fluorouracil and leucovorin in metastatic pancreatic adenocarcinoma.,2025 Mar 4,Yang SH; Huang CJ; Chiu SC; Kao HF; Lu LC; Shan YS; Kuo SH; Yeh KH,,
40044497,Margin thermal ablation eliminates size as a risk factor for recurrence after piecemeal endoscopic mucosal resection of large non-pedunculated colorectal polyps.,2025 Mar 5,Gauci JL; Mandarino FV; Kerrison C; Whitfield AM; O'Sullivan T; Gupta S; Lam B; Perananthan V; Cronin O; Lee EY; Williams SJ; Burgess N; Bourke MJ,,
40044459,Australian adolescents' knowledge of smoking harms and misperceptions about tobacco products: a cross-sectional study.,2025 Mar 5,Scully M; Wakefield MA; Baker E; Koh I; Scollo M; Brennan E; White VM; Durkin SJ,,
40044439,[Predictive significance of microcystic elongated and fragmented (MELF) growth pattern in the prognosis of no specific molecular profile endometrial endometrioid carcinoma].,2025 Mar 11,Song ZX; Leng H; Zhao XY; Zhu L; Liu Y; Liu CR,,
40044309,Using Self-Scheduling to Improve Screening Mammography Completion Rates.,2025 Mar,Cortes G; Chen WP; Aryagus Z; Rashidi A; Tsai I; Sadigh G,,
40044307,Incidentally Detected Adrenal Nodules on Lung Cancer Screening CT.,2025 Mar,Singh A; Hammer MM; Byrne SC,,
40044305,Patient-Reported Barriers and Preferred Interventions to Improve Lung Cancer Screening Uptake.,2025 Mar,Jung J; Razzak E; Avenido AR; Rashidi A; Jia S; Tran NQ; Yao R; Nguyen EL; Bernaba A; Echeverria R; Nguyen TQ; Imanzadeh A; Sadigh G,,
40044112,Is clinical complete response as accurate as pathological complete response in patients with mid-low locally advanced rectal cancer?,2025 Feb,Shadmanov N; Aliyev V; Piozzi GN; Bakır B; Goksel S; Asoglu O,,
40044111,The effect of tumor resection on intestinal microbiota dysbiosis in patients with right-sided colon cancer.,2025 Feb,Pratikna AM; Rivai MI; Suswita R; Putra AE; Rachman IA; Suchitra A,,
40043950,[Patient satisfaction regarding hypnosis-assisted oocyte retrieval under local anesthesia].,2025 Mar 3,Cervantes C; Bourdon M; Maignien C; Galducci G; Patrat C; Blanchet V; Gonnot J; Houliat A; Laviron E; Chapron C; Santulli P,,
40043728,Electronic Cigarettes Versus Combustible Cigarettes in Oral Squamous Cell Cancer Patients: A Systematic Review.,2025 Mar 5,Pérez-Leal M; El Helou B; Roger I,,
40043632,Prospective cohort study of Suture-Line recurrence and clinical outcomes in stage 1A Non-Small cell lung cancer.,2025 Mar 1,Gros L; Yip R; Flores RM; Zhang J; Paksashvili N; Zhang L; Lyu L; Cai S; Taioli E; Yankelevitz DF; Henschke CI; IELCART Investigators,,
40043551,Exploring the integration of patient-reported outcome measures in clinical practice: A cross-sectional survey of EORTC healthcare professionals.,2025 Mar 1,Lehmann J; Dragan T; Rammant E; de Ligt KM; Lai-Kwon J; Lidington E; Bultijnck R; Dejaco D; Taylor KJ; Gašpert T; Colombo E; Madariaga A; Brandão M; Nicolay JP; Zerdes I; Bosisio F; Correia D; Pellerino A; Marquina G; Fontes-Sousa M; Grisay G; Silva T; Siebenhüner A; Cammarota A; Szturz P,,
40043500,Health risk assessment to xenoestrogen through atmospheric PM(2.5) particles: A case study in Suzhou.,2025 Mar 4,Wang M; Li D; Tong T; Xia Y; Zhang H; Zhou X; Jiang W; Chen K; Wang F; Zhao P; Han L,,
40043354,Clinical description and development of a prognostic score for neurofibromatosis type 1 (NF1)-associated GISTs: a retrospective study from the NETSARC.,2025 Mar 4,Cuvelier C; Brahmi M; Sobhani I; Verret B; Grancher A; Penel N; Toulmonde M; Lahlou W; Dupuis H; Calavas L; Muller M; Watson S; Bruyat D; Poumeaud F; Chaigneau L; Manfredi S; Lecomte T; Bertucci F; Ghiringhelli F; Pracht M; Mourthadhoi F; Monceau-Baroux L; Helyon M; Kurtz JE; Roquin G; Regenet N; Vinches M; Tougeron D; Wolkenstein P; Blay JY; Bouche O; Hautefeuille V,,
40043329,A patient-centric approach to neuro-recovery after acute brain injuries.,2025 Mar 4,Ur Rehman MA; Emerson K; Merker VL; Young M; Lin DJ; Zafar SF,,
40043099,E. B. Hershberg Award: Taming Inflammation by Tuning Purinergic Signaling.,2025 Mar 5,Jacobson KA,,
40043020,Improving cervical cancer screening rates at a Federally Qualified Health Center.,2025 Mar 5,McCann LA; Kozlowski M; Martinez M,,
40042865,Cancer Screening 3 Years After the Onset of the COVID-19 Pandemic.,2025 Mar 5,Star J; Han X; Smith RA; Schafer EJ; Jemal A; Bandi P,,
40042845,Daily or Nondaily Vaping and Smoking Cessation Among Smokers.,2025 Mar 3,Quach NE; Pierce JP; Chen J; Dang B; Stone MD; Strong DR; Trinidad DR; McMenamin SB; Messer K,,
40042811,Postoperative hyperfractionated IMRT with weekly cisplatin for head and neck cancer: phase IIa trial.,2025 Mar 5,Hiraoka S; Nakajima A; Kikuchi M; Nomura M; Imagumbai T; Yoshimura M; Nakashima R; Kishimoto Y; Shinohara S; Kokubo M; Omori K; Mizowaki T,,
40042799,Neoadjuvant Chemotherapy for Intraductal Papillary Mucinous Neoplasm-derived Pancreatic Cancer.,2025 Mar 5,Habib JR; Rompen IF; Javed AA; Campbell BA; Kinny-Köster B; Tan PH; Miller RM; Pellegrini R; Marchetti A; Andel PCM; Perri G; Lafaro KJ; Hewitt DB; Kaiser J; Daamen LA; Hank T; Sacks GD; Billeter AT; Morgan K; Busch OR; Müller-Stich BP; Marchegiani G; Ven Fong Z; Molenaar IQ; Besselink MG; Büchler MW; Wolfgang CL; He J; Loos M,,
40042780,Does robotic assisted surgery mitigate obesity related systemic inflammatory response and clinical outcomes in left sided colorectal cancer resections?,2025 Mar 5,Ingham AR; McSorley ST; McMillan DC; Mansouri D; Chong D; MacKay GJ; Wrobel A; Kong CY; Alani A; Nicholson G; Roxburgh CSD,,
40042742,Health-related social needs mitigate ethnoracial inequities in patient-reported mental health.,2025 Mar 5,Kaur MN; Zeng C; Malapati SH; McCleary NJ; Meyers P; Bryant AS; Pusic AL; Edelen MO,,
40042696,Advances in magnetic affinity-based isolation/detection of exosomes for robust diagnostics.,2025 Mar 5,Solovicová V; Ďatková A; Bertók T; Kasák P; Vikartovská A; Lorencová L; Tkac J,,
40042691,Antibody-positive paraneoplastic neurological syndromes associated with immune checkpoint inhibitors: a systematic review.,2025 Mar 5,Zhang L; Fan S; Wang J; Ren H; Guan H,,
40042659,Assessing operative variability in robot-assisted radical prostatectomy (RARP) through AI.,2025 Mar 5,Zuluaga L; Bamby J; Okhawere KE; Ucpinar B; Razdan S; Badani KK,,
40042577,Laparoscopic Extended Segmentectomy VII Guided by the Right Hepatic Vein: Precise Surgical Planning with a Three-Dimensional Liver Model.,2025 Mar 5,Wang L; Li X; Song Z; Zhao Y; Yang J; Tao H,,
40042572,Efficacy of transarterial chemoembolization combined with radiofrequency ablation in the treatment of liver metastases from colorectal cancer.,2025 Mar 5,Yin J; Zhao Y; Yin J; Yang S,,
40042527,"Diet, fruit and vegetables and One Health: benefits for health, environment, society and the consumer-proceedings of the 9th edition of EGEA conference.",2025 Mar 5,Komati N; Riboli E; Dore J; Boyland E; Cravedi JP; Folkvord F; Lecerf JM; Lescourret F; Peeters A; Reynolds C; Alles B; Amiot MJ; Binard P; Delzenne N; Forouhi N; Giner C; Giyose B; Gonzalez CG; Gunter MJ; Kahane R; Herforth A; Hermans R; Intrigliolo DS; Montanaro G; Neri D; Nicklaus S; Santacoloma P; Sauvaitre D; Selosse MA; Smits T; Stranges S; Thivel D; Toledo PC; Van Lieshout M; Verschuren WMM; Wickramasinghe K; Zeinstra G; Chambrier C; Calvarin J; Tailliez D,,
40042188,Fluorescence-guided mesorectal nodes harvesting associated with local excision for early rectal cancer: technical notes.,2025 Mar 5,Benzoni I; Fricano M; Borali J; Bonafede M; Celotti A; Tarasconi A; Ranieri V; Totaro L; Quarti LM; Dendena A; Grizzi G; Bonomi M; Grassia R; Frittoli B; Baiocchi GL,,
40042091,SERS-Based Assessment of DNA Methylation for the Evaluation of Measurable Residual Disease in Acute Promyelocytic Leukaemia.,2025 Mar,Bancos A; Iancu SD; Moisoiu V; Ghiaur A; Tigu AB; Buran C; Ion G; Stancioaica C; Ionescu B; Dragomir M; Buldus CF; Cenariu D; Nistor M; Kegyes D; Gulei D; Leopold N; Coriu D; Tomuleasa C,,
40042073,"Associations Between Exercise Training, Physical Activity, Sedentary Behaviour and Mortality: An Umbrella Review of Meta-Analyses.",2025 Apr,Rahmati M; Lee H; Lee H; Park J; Vithran DTA; Li Y; Kazemi A; Boyer L; Fond G; Smith L; Veronese N; Soysal P; Dragioti E; Cortese S; Kang J; Yon DK; Solmi M,,
